{
  "$schema": "https://json-schema.org/draft/2020-12/schema",
  "$id": "https://github.com/peteski22/agent-pragma/spec/council-protocol/schemas/council-output.schema.json",
  "title": "Council Output",
  "description": "Final aggregated output from a council review or design question session.",
  "type": "object",
  "required": ["mode", "providers_used", "providers_responded", "failed_providers", "summary"],
  "properties": {
    "mode": {
      "type": "string",
      "enum": ["code-review", "design-question"],
      "description": "Invocation mode."
    },
    "files_reviewed": {
      "type": "array",
      "description": "List of reviewed file paths (code-review mode).",
      "items": { "type": "string" }
    },
    "providers_used": {
      "type": "array",
      "description": "The roster that was asked: all council members consulted, including those that failed, identified by display name. This is not the roster that answered; see providers_responded.",
      "items": { "type": "string" }
    },
    "reviews": {
      "type": "array",
      "description": "Each answering member's parsed review, in full (code-review mode).",
      "items": {
        "type": "object",
        "required": ["provider", "model", "quality_rating", "issues", "praise", "summary", "raw_content"],
        "properties": {
          "provider": {
            "type": "string",
            "description": "Member display name."
          },
          "model": {
            "type": "string",
            "description": "Model that produced this review."
          },
          "quality_rating": {
            "type": "string",
            "enum": ["excellent", "good", "fair", "needs-work"]
          },
          "issues": {
            "type": "array",
            "description": "Every issue this member raised, before classification.",
            "items": { "$ref": "#/$defs/issue" }
          },
          "praise": {
            "type": "array",
            "description": "Positive observations from this member.",
            "items": { "type": "string" }
          },
          "summary": {
            "type": "string",
            "description": "This member's own summary of its review."
          },
          "raw_content": {
            "type": "string",
            "description": "The member's unparsed response text."
          }
        },
        "additionalProperties": false
      }
    },
    "providers_responded": {
      "type": "array",
      "description": "The roster that answered: council members that returned a usable response, identified by display name. This is the denominator the consensus, majority, and individual classifications were computed over.",
      "items": { "type": "string" }
    },
    "failed_providers": {
      "type": "array",
      "description": "Providers that failed or returned malformed responses.",
      "items": {
        "type": "object",
        "required": ["provider", "error"],
        "properties": {
          "provider": {
            "type": "string",
            "description": "Member display name."
          },
          "error": {
            "type": "string",
            "description": "Error description."
          }
        },
        "additionalProperties": false
      }
    },
    "consensus_issues": {
      "type": "array",
      "description": "Issues flagged by every member in providers_responded (code-review mode).",
      "items": { "$ref": "#/$defs/issue" }
    },
    "majority_issues": {
      "type": "array",
      "description": "Issues flagged by more than one but not all members in providers_responded (code-review mode).",
      "items": {
        "type": "object",
        "required": ["severity", "location", "category", "description", "suggestion", "provider_count", "flagged_by"],
        "properties": {
          "severity": {
            "type": "string",
            "enum": ["high", "medium", "low"]
          },
          "location": { "type": "string" },
          "category": {
            "type": "string",
            "enum": ["craftsmanship", "architecture", "correctness", "invariants", "maintainability"]
          },
          "description": { "type": "string" },
          "suggestion": { "type": "string" },
          "provider_count": {
            "type": "integer",
            "description": "Number of providers that flagged this issue.",
            "minimum": 2
          },
          "flagged_by": {
            "type": "array",
            "description": "Display names of members that flagged this issue.",
            "items": { "type": "string" },
            "minItems": 2
          }
        },
        "additionalProperties": false
      }
    },
    "individual_issues": {
      "type": "object",
      "description": "Issues flagged by a single member, keyed by member display name (code-review mode).",
      "additionalProperties": {
        "type": "array",
        "items": { "$ref": "#/$defs/issue" }
      }
    },
    "quality_ratings": {
      "type": "object",
      "description": "Per-member quality rating, keyed by display name (code-review mode).",
      "additionalProperties": {
        "type": "string",
        "enum": ["excellent", "good", "fair", "needs-work"]
      }
    },
    "prompt": {
      "type": "string",
      "description": "The original design question (design-question mode). Enables rendering the markdown template without external context."
    },
    "consensus_recommendation": {
      "type": ["string", "null"],
      "description": "High-level consensus recommendation when every provider that answered agrees on a general direction (design-question mode). Differing specifics count only where a synthesis step establishes the shared direction. Without one the value is identical recommendation text or one approach every provider named, and is null otherwise."
    },
    "approaches": {
      "type": "array",
      "description": "All approaches mentioned by any provider, including those not recommended (design-question mode).",
      "items": {
        "type": "object",
        "required": ["name", "recommended_by", "pros", "cons", "risk_level"],
        "properties": {
          "name": { "type": "string" },
          "recommended_by": {
            "type": "integer",
            "description": "Number of providers recommending this approach. Zero indicates the approach was discussed but not recommended.",
            "minimum": 0
          },
          "pros": {
            "type": "array",
            "items": { "type": "string" }
          },
          "cons": {
            "type": "array",
            "items": { "type": "string" }
          },
          "risk_level": {
            "type": "string",
            "enum": ["low", "medium", "high", "unknown"],
            "description": "Aggregated risk level. 'unknown' when no provider stated one."
          },
          "fit_rating": {
            "type": ["string", "null"],
            "enum": ["excellent", "good", "fair", "poor", null],
            "description": "Aggregated fit rating. When providers disagree, use the most common rating. Null when no provider assessed fit for this approach."
          }
        },
        "additionalProperties": false
      }
    },
    "summary": {
      "type": "object",
      "description": "Summary counts and synthesis.",
      "properties": {
        "total_issues": {
          "type": "integer",
          "description": "Total number of unique issues found (code-review mode)."
        },
        "consensus_count": {
          "type": "integer",
          "description": "Number of consensus issues (code-review mode)."
        },
        "majority_count": {
          "type": "integer",
          "description": "Number of majority issues (code-review mode)."
        },
        "synthesis": {
          "type": "string",
          "description": "1-2 sentence overall synthesis."
        }
      },
      "additionalProperties": false
    },
    "debate": {
      "type": "object",
      "description": "Debate metadata. Present only when debate mode was used.",
      "properties": {
        "rounds_completed": {
          "type": "integer",
          "description": "Number of debate rounds completed.",
          "minimum": 1
        },
        "converged": {
          "type": "boolean",
          "description": "Whether the debate converged early."
        }
      },
      "required": ["rounds_completed", "converged"],
      "additionalProperties": false
    }
  },
  "allOf": [
    {
      "if": {
        "properties": { "mode": { "const": "code-review" } }
      },
      "then": {
        "required": ["files_reviewed", "reviews", "consensus_issues", "majority_issues", "individual_issues", "quality_ratings"],
        "not": {
          "anyOf": [
            { "required": ["prompt"] },
            { "required": ["approaches"] },
            { "required": ["consensus_recommendation"] }
          ]
        },
        "properties": {
          "summary": {
            "required": ["total_issues", "consensus_count", "majority_count", "synthesis"]
          }
        }
      }
    },
    {
      "if": {
        "properties": { "mode": { "const": "design-question" } }
      },
      "then": {
        "required": ["prompt", "approaches"],
        "not": {
          "anyOf": [
            { "required": ["files_reviewed"] },
            { "required": ["reviews"] },
            { "required": ["consensus_issues"] },
            { "required": ["majority_issues"] },
            { "required": ["individual_issues"] },
            { "required": ["quality_ratings"] }
          ]
        },
        "properties": {
          "summary": {
            "required": ["synthesis"]
          }
        }
      }
    }
  ],
  "additionalProperties": false,
  "$defs": {
    "issue": {
      "description": "One issue as a member reported it. majority_issues declares this shape inline because it adds two fields, and additionalProperties:false does not compose through a $ref.",
      "type": "object",
      "required": ["severity", "location", "category", "description", "suggestion"],
      "properties": {
        "severity": {
          "type": "string",
          "enum": ["high", "medium", "low"]
        },
        "location": { "type": "string" },
        "category": {
          "type": "string",
          "enum": ["craftsmanship", "architecture", "correctness", "invariants", "maintainability"]
        },
        "description": { "type": "string" },
        "suggestion": { "type": "string" }
      },
      "additionalProperties": false
    }
  }
}
