{
  "mode": "code-review",
  "files_reviewed": [
    "backend/app/services/auth.py",
    "backend/app/api/routes/auth.py"
  ],
  "providers_used": ["openai", "anthropic", "gemini", "deepseek"],
  "providers_responded": ["openai", "anthropic", "gemini"],
  "failed_providers": [
    {
      "provider": "deepseek",
      "error": "Request timed out after 60s"
    }
  ],
  "consensus_issues": [
    {
      "severity": "high",
      "location": "backend/app/services/auth.py:23",
      "category": "correctness",
      "description": "SHA-256 is not suitable for password hashing. It is too fast and lacks salting, making it vulnerable to brute-force and rainbow table attacks. Project rules require bcrypt.",
      "suggestion": "Replace hashlib.sha256 with bcrypt.checkpw/bcrypt.hashpw."
    },
    {
      "severity": "medium",
      "location": "backend/app/api/routes/auth.py:11",
      "category": "correctness",
      "description": "auth_service is referenced but never defined or imported in the routes module. This will cause a NameError at runtime.",
      "suggestion": "Inject AuthService via Flask's application context or a factory pattern."
    }
  ],
  "majority_issues": [],
  "individual_issues": {
    "openai": [
      {
        "severity": "low",
        "location": "backend/app/services/auth.py:34",
        "category": "maintainability",
        "description": "get_current_user returns None for invalid tokens, inconsistent with the exception-raising pattern in login.",
        "suggestion": "Raise AuthError for invalid tokens or document the None-return contract."
      }
    ],
    "anthropic": [
      {
        "severity": "medium",
        "location": "backend/app/services/auth.py:27",
        "category": "architecture",
        "description": "Session token is stored as plain text in the database.",
        "suggestion": "Store a hash of the token and compare hashes on lookup."
      }
    ],
    "gemini": [
      {
        "severity": "low",
        "location": "backend/app/api/routes/auth.py:22",
        "category": "craftsmanship",
        "description": "The /me endpoint lacks a docstring, violating project rules.",
        "suggestion": "Add a Google-style docstring."
      }
    ]
  },
  "quality_ratings": {
    "openai": "fair",
    "anthropic": "fair",
    "gemini": "fair"
  },
  "reviews": [
    {
      "provider": "openai",
      "model": "gpt-4o",
      "quality_rating": "fair",
      "issues": [
        {
          "severity": "high",
          "location": "backend/app/services/auth.py:23",
          "category": "correctness",
          "description": "Using SHA-256 for password hashing is insecure. SHA-256 is fast and vulnerable to brute-force attacks.",
          "suggestion": "Use bcrypt or argon2 for password hashing. Replace hashlib.sha256 with bcrypt.checkpw."
        },
        {
          "severity": "medium",
          "location": "backend/app/api/routes/auth.py:11",
          "category": "correctness",
          "description": "auth_service is referenced but never defined in this module. This will raise a NameError at runtime.",
          "suggestion": "Inject AuthService via Flask's app context or a dependency injection pattern."
        },
        {
          "severity": "low",
          "location": "backend/app/services/auth.py:34",
          "category": "maintainability",
          "description": "get_current_user returns None for invalid tokens. Consider raising an exception for consistency with the login method.",
          "suggestion": "Raise AuthError for invalid tokens, or document the None-return contract clearly."
        }
      ],
      "praise": [
        "Clean separation between service and route layers.",
        "Good use of type hints throughout."
      ],
      "summary": "The authentication implementation has a critical security flaw (SHA-256 for passwords) and a runtime error (undefined auth_service). The code structure is clean but needs these issues addressed before deployment.",
      "raw_content": "```json\n{\n  \"provider\": \"openai\",\n  \"quality_rating\": \"fair\",\n  \"issues\": [\n    {\n      \"severity\": \"high\",\n      \"location\": \"backend/app/services/auth.py:23\",\n      \"category\": \"correctness\",\n      \"description\": \"Using SHA-256 for password hashing is insecure. SHA-256 is fast and vulnerable to brute-force attacks.\",\n      \"suggestion\": \"Use bcrypt or argon2 for password hashing. Replace hashlib.sha256 with bcrypt.checkpw.\"\n    },\n    {\n      \"severity\": \"medium\",\n      \"location\": \"backend/app/api/routes/auth.py:11\",\n      \"category\": \"correctness\",\n      \"description\": \"auth_service is referenced but never defined in this module. This will raise a NameError at runtime.\",\n      \"suggestion\": \"Inject AuthService via Flask's app context or a dependency injection pattern.\"\n    },\n    {\n      \"severity\": \"low\",\n      \"location\": \"backend/app/services/auth.py:34\",\n      \"category\": \"maintainability\",\n      \"description\": \"get_current_user returns None for invalid tokens. Consider raising an exception for consistency with the login method.\",\n      \"suggestion\": \"Raise AuthError for invalid tokens, or document the None-return contract clearly.\"\n    }\n  ],\n  \"praise\": [\n    \"Clean separation between service and route layers.\",\n    \"Good use of type hints throughout.\"\n  ],\n  \"summary\": \"The authentication implementation has a critical security flaw (SHA-256 for passwords) and a runtime error (undefined auth_service). The code structure is clean but needs these issues addressed before deployment.\"\n}\n```"
    },
    {
      "provider": "anthropic",
      "model": "claude-sonnet-4-20250514",
      "quality_rating": "fair",
      "issues": [
        {
          "severity": "high",
          "location": "backend/app/services/auth.py:23",
          "category": "correctness",
          "description": "SHA-256 is not a suitable password hashing algorithm. It lacks salting and is too fast, making it vulnerable to rainbow table and brute-force attacks.",
          "suggestion": "Use bcrypt: import bcrypt; bcrypt.checkpw(password.encode(), user.password_hash.encode())."
        },
        {
          "severity": "medium",
          "location": "backend/app/api/routes/auth.py:13",
          "category": "correctness",
          "description": "auth_service is used as a module-level variable but is never initialised. This will cause a NameError.",
          "suggestion": "Use Flask's current_app pattern or a factory function to provide the AuthService instance."
        },
        {
          "severity": "medium",
          "location": "backend/app/services/auth.py:27",
          "category": "architecture",
          "description": "Session token generation uses os.urandom which is correct, but the token is stored as plain text. Consider hashing the stored token.",
          "suggestion": "Store a hash of the token in the database and compare hashes on lookup."
        }
      ],
      "praise": [
        "Type hints are consistently applied.",
        "Error messages in AuthError don't leak whether the email or password was wrong — good security practice."
      ],
      "summary": "The code follows good structural patterns with a clean service/route split, but has a critical password hashing vulnerability and an undefined variable that would prevent the route from working. Token storage could also be improved.",
      "raw_content": "```json\n{\n  \"provider\": \"anthropic\",\n  \"quality_rating\": \"fair\",\n  \"issues\": [\n    {\n      \"severity\": \"high\",\n      \"location\": \"backend/app/services/auth.py:23\",\n      \"category\": \"correctness\",\n      \"description\": \"SHA-256 is not a suitable password hashing algorithm. It lacks salting and is too fast, making it vulnerable to rainbow table and brute-force attacks.\",\n      \"suggestion\": \"Use bcrypt: import bcrypt; bcrypt.checkpw(password.encode(), user.password_hash.encode()).\"\n    },\n    {\n      \"severity\": \"medium\",\n      \"location\": \"backend/app/api/routes/auth.py:13\",\n      \"category\": \"correctness\",\n      \"description\": \"auth_service is used as a module-level variable but is never initialised. This will cause a NameError.\",\n      \"suggestion\": \"Use Flask's current_app pattern or a factory function to provide the AuthService instance.\"\n    },\n    {\n      \"severity\": \"medium\",\n      \"location\": \"backend/app/services/auth.py:27\",\n      \"category\": \"architecture\",\n      \"description\": \"Session token generation uses os.urandom which is correct, but the token is stored as plain text. Consider hashing the stored token.\",\n      \"suggestion\": \"Store a hash of the token in the database and compare hashes on lookup.\"\n    }\n  ],\n  \"praise\": [\n    \"Type hints are consistently applied.\",\n    \"Error messages in AuthError don't leak whether the email or password was wrong — good security practice.\"\n  ],\n  \"summary\": \"The code follows good structural patterns with a clean service/route split, but has a critical password hashing vulnerability and an undefined variable that would prevent the route from working. Token storage could also be improved.\"\n}\n```"
    },
    {
      "provider": "gemini",
      "model": "gemini-2.0-flash",
      "quality_rating": "fair",
      "issues": [
        {
          "severity": "high",
          "location": "backend/app/services/auth.py:23",
          "category": "correctness",
          "description": "Password hashing uses SHA-256 which is cryptographically unsuitable for password storage. Project rules explicitly require bcrypt.",
          "suggestion": "Replace with bcrypt. Install the bcrypt package and use bcrypt.hashpw/bcrypt.checkpw."
        },
        {
          "severity": "medium",
          "location": "backend/app/api/routes/auth.py:11",
          "category": "correctness",